{
  "acceptance_criteria": [
    "demo 链路以 0 退出。"
  ],
  "created_at": "2026-07-02T04:51:56+00:00",
  "depends_on": [],
  "non_goals": [
    "不执行真实提交、发布或远端写入。"
  ],
  "profile": "default-development",
  "run_id": "0001",
  "state": "planned",
  "task_id": "001_demo-task",
  "title": "demo task",
  "updated_at": "2026-07-02T04:51:56+00:00"
}
